[
  {
    "id": "SCN-ZZP-001",
    "user_type": "zzp",
    "year": 2026,
    "title": "IT consultant, year 3, medium income",
    "profile": {
      "annual_revenue_zzp": 72000,
      "business_expenses": 9500,
      "hours_per_year": 1380,
      "years_as_entrepreneur": 3,
      "is_starter": true,
      "has_partner": false,
      "partner_income": null,
      "children": 0,
      "children_under_12": 0,
      "rent_per_month": 1100,
      "net_assets_box3": 12000,
      "has_company_bv": false,
      "uses_30pct_ruling": false,
      "pension_contribution": 0,
      "kia_investments": 4500,
      "single_client_percentage": 65
    },
    "calculation": {
      "gross_revenue": 72000,
      "business_expenses": 9500,
      "gross_profit": 62500,
      "zelfstandigenaftrek": 1200,
      "startersaftrek": 2123,
      "kia_deduction": 1260,
      "pension_deduction": 0,
      "ondernemersaftrek_total": 4583,
      "profit_after_ondernemers": 57917,
      "mkb_winstvrijstelling": 7355,
      "taxable_income_box1": 50562,
      "box1_tax_bracket1": 13901,
      "box1_tax_bracket2": 4329,
      "box1_tax_bracket3": 0,
      "box1_tax_raw": 18230,
      "algemene_heffingskorting": 1783,
      "arbeidskorting": 5361,
      "iack": 0,
      "income_tax_after_credits": 11086,
      "zvw_contribution": 2452,
      "box2_tax": 0,
      "box3_tax": 0,
      "total_tax_due": 13538,
      "effective_rate": 0.217
    },
    "result": {
      "total_tax_due": 13538,
      "effective_rate": 0.217,
      "monthly_reserve_needed": 1128,
      "eligible_toeslagen": [],
      "toeslagen_value": 0,
      "optimization_opportunities": [
        "Pension contribution (jaarruimte ~€12,954): could save ~€4,634 in taxes",
        "KIA already applied (€1,260 saved) — check if more equipment planned",
        "Startersaftrek (last year!): already applied",
        "Single client risk (65%): should diversify — Wet DBA concern"
      ],
      "wet_dba_risk": "medium",
      "key_insights": [
        "Startersaftrek saved €798 in taxes — 2026 is the LAST year to use it",
        "KIA on €4,500 equipment investment saved €450 in taxes",
        "ZVW adds €2,690 on top of income tax — always reserve for this",
        "Effective rate 23.6% is reasonable — but pension optimization could reduce significantly",
        "65% revenue from single client creates medium Wet DBA risk"
      ]
    },
    "rule_ids_applied": [
      "ZA-2026-001",
      "SA-2026-001",
      "KIA-2026-001",
      "MKB-2026-001",
      "BR1-2026-001",
      "AHK-2026-001",
      "AK-2026-001",
      "ZVW-2026-001"
    ],
    "tags": [
      "zzp",
      "it",
      "starter",
      "medium_income",
      "single_client_risk"
    ]
  },
  {
    "id": "SCN-ZZP-002",
    "user_type": "zzp",
    "year": 2026,
    "title": "Graphic designer, year 1, low income, parental leave year",
    "profile": {
      "annual_revenue_zzp": 28000,
      "business_expenses": 3200,
      "hours_per_year": 980,
      "years_as_entrepreneur": 1,
      "is_starter": true,
      "has_partner": true,
      "partner_income": 42000,
      "children": 1,
      "children_under_12": 1,
      "rent_per_month": 850,
      "net_assets_box3": 5000,
      "has_company_bv": false,
      "uses_30pct_ruling": false,
      "pension_contribution": 0,
      "kia_investments": 1800,
      "single_client_percentage": 30
    },
    "calculation": {
      "gross_revenue": 28000,
      "business_expenses": 3200,
      "gross_profit": 24800,
      "zelfstandigenaftrek": 0,
      "startersaftrek": 0,
      "kia_deduction": 0,
      "pension_deduction": 0,
      "ondernemersaftrek_total": 0,
      "profit_after_ondernemers": 24800,
      "mkb_winstvrijstelling": 3150,
      "taxable_income_box1": 21650,
      "box1_tax_bracket1": 7740,
      "box1_tax_bracket2": 0,
      "box1_tax_bracket3": 0,
      "box1_tax_raw": 7740,
      "algemene_heffingskorting": 3115,
      "arbeidskorting": 3999,
      "iack": 1765,
      "income_tax_after_credits": 0,
      "zvw_contribution": 1050,
      "box2_tax": 0,
      "box3_tax": 0,
      "total_tax_due": 1050,
      "effective_rate": 0.042
    },
    "result": {
      "total_tax_due": 1050,
      "effective_rate": 0.042,
      "monthly_reserve_needed": 88,
      "eligible_toeslagen": [
        "zorgtoeslag",
        "huurtoeslag",
        "kindgebonden_budget"
      ],
      "toeslagen_value": 4800,
      "optimization_opportunities": [
        "CRITICAL: Did NOT meet urencriterium (980 < 1225 hours) — no zelfstandigenaftrek",
        "KIA investments only €1,800 — below €2,901 threshold, no KIA benefit",
        "Zorgtoeslag: estimate €100/month = €1,200/year",
        "Huurtoeslag likely eligible at €850/month rent",
        "Kindgebonden budget eligible for child"
      ],
      "wet_dba_risk": "low",
      "key_insights": [
        "Very low effective tax rate (4.8%) because heffingskortingen cover most tax",
        "IACK (€1,770) significantly reduces taxes for working parent",
        "Missed urencriterium — needs to track hours carefully in year 2 to qualify for zelfstandigenaftrek",
        "Toeslagen (€4,800 estimated) worth MORE than total tax bill — always check eligibility",
        "ZVW (€1,152) is the largest single tax item this year"
      ]
    },
    "rule_ids_applied": [
      "MKB-2026-001",
      "BR1-2026-001",
      "AHK-2026-001",
      "AK-2026-001",
      "IACK-2026-001",
      "ZVW-2026-001",
      "ZT-2026-001",
      "HT-2026-001"
    ],
    "tags": [
      "zzp",
      "design",
      "low_income",
      "parent",
      "toeslagen",
      "missed_urencriterium"
    ]
  },
  {
    "id": "SCN-ZZP-003",
    "user_type": "zzp",
    "year": 2026,
    "title": "Senior consultant, high income, pension optimization",
    "profile": {
      "annual_revenue_zzp": 140000,
      "business_expenses": 15000,
      "hours_per_year": 1600,
      "years_as_entrepreneur": 8,
      "is_starter": false,
      "has_partner": true,
      "partner_income": 55000,
      "children": 2,
      "children_under_12": 0,
      "rent_per_month": null,
      "net_assets_box3": 95000,
      "has_company_bv": false,
      "uses_30pct_ruling": false,
      "pension_contribution": 18000,
      "kia_investments": 8000,
      "single_client_percentage": 45
    },
    "calculation": {
      "gross_revenue": 140000,
      "business_expenses": 15000,
      "gross_profit": 125000,
      "zelfstandigenaftrek": 1200,
      "startersaftrek": 0,
      "kia_deduction": 2240,
      "pension_deduction": 18000,
      "ondernemersaftrek_total": 3440,
      "profit_after_ondernemers": 121560,
      "mkb_winstvrijstelling": 15438,
      "taxable_income_box1": 88122,
      "box1_tax_bracket1": 13901,
      "box1_tax_bracket2": 14659,
      "box1_tax_bracket3": 4800,
      "box1_tax_raw": 33359,
      "algemene_heffingskorting": 0,
      "arbeidskorting": 2916,
      "iack": 0,
      "income_tax_after_credits": 30443,
      "zvw_contribution": 3851,
      "box2_tax": 0,
      "box3_tax": 0,
      "total_tax_due": 34294,
      "effective_rate": 0.274
    },
    "result": {
      "total_tax_due": 34294,
      "effective_rate": 0.274,
      "monthly_reserve_needed": 2858,
      "eligible_toeslagen": [],
      "toeslagen_value": 0,
      "optimization_opportunities": [
        "Pension deduction €18,000 already applied — check if jaarruimte fully used",
        "Consider BV structure: at this income, BV tax (19% VPB + 24.5% Box 2) could be more efficient",
        "Box 3 at €95k — check if exemption (€59,357) is being doubled with partner",
        "Reserveringsruimte check: unused jaarruimte from past 10 years can be used now"
      ],
      "wet_dba_risk": "low",
      "key_insights": [
        "Pension contribution of €18,000 saved ~€6,435 in taxes (at 35.75% + 49.5% blended)",
        "ZVW capped at max €3,810 — profit above €71,628 not subject to additional ZVW",
        "AHK phases out to €0 at this income level — no general credit",
        "BV structure worth modeling: consistent €125k+ profit makes BV increasingly attractive",
        "Effective rate 25.7% is already optimized — primary lever now is pension"
      ]
    },
    "rule_ids_applied": [
      "ZA-2026-001",
      "KIA-2026-001",
      "LR-2026-001",
      "MKB-2026-001",
      "BR1-2026-001",
      "BR1-2026-003",
      "ZVW-2026-001",
      "B3R-2026-001"
    ],
    "tags": [
      "zzp",
      "high_income",
      "pension_optimized",
      "bv_consideration",
      "box3"
    ]
  },
  {
    "id": "SCN-EMP-001",
    "user_type": "employee",
    "year": 2026,
    "title": "Mid-level employee with side savings, single",
    "profile": {
      "annual_revenue_zzp": null,
      "business_expenses": null,
      "employment_income": 48000,
      "hours_per_year": null,
      "years_as_entrepreneur": 0,
      "is_starter": false,
      "has_partner": false,
      "partner_income": null,
      "children": 0,
      "children_under_12": 0,
      "rent_per_month": 1050,
      "net_assets_box3": 72000,
      "has_company_bv": false,
      "uses_30pct_ruling": false,
      "pension_contribution": 0,
      "kia_investments": 0,
      "single_client_percentage": null
    },
    "calculation": {
      "gross_revenue": 48000,
      "business_expenses": 0,
      "gross_profit": 48000,
      "zelfstandigenaftrek": 0,
      "startersaftrek": 0,
      "kia_deduction": 0,
      "pension_deduction": 0,
      "ondernemersaftrek_total": 0,
      "profit_after_ondernemers": 48000,
      "mkb_winstvrijstelling": 0,
      "taxable_income_box1": 48000,
      "box1_tax_bracket1": 13901,
      "box1_tax_bracket2": 3380,
      "box1_tax_bracket3": 0,
      "box1_tax_raw": 17280,
      "algemene_heffingskorting": 1946,
      "arbeidskorting": 5528,
      "iack": 0,
      "income_tax_after_credits": 9806,
      "zvw_contribution": 0,
      "box2_tax": 0,
      "box3_tax": 273,
      "total_tax_due": 10079,
      "effective_rate": 0.21
    },
    "result": {